{
  "$schema": "../schema/artist-style.schema.json",
  "id": "ol-dirty-bastard",
  "type": "artist",
  "name": "Ol' Dirty Bastard",
  "aliases": [
    "ol dirty bastard",
    "odb",
    "dirt mcgirt",
    "big baby jesus",
    "russell jones"
  ],
  "tier": "flagship",
  "extends": [
    "boom-bap"
  ],
  "era": "1995-1999",
  "genres": [
    "rap",
    "boom-bap",
    "blues"
  ],
  "relatedGenres": [
    "boom-bap",
    "funk",
    "neo-soul"
  ],
  "confidence": "medium",
  "sources": [
    "style-research-extended vol.1 boom-bap — Ol' Dirty Bastard",
    "Wikipedia — Ol' Dirty Bastard",
    "Medium/Micro-Chop — RZA and ODB's early beatmaking"
  ],
  "notes": "The only Wu model here in a major key and the only one authored as loose. Two research claims drive it. \"Occasionally hand-played and un-quantised; hat patterns irregular\" gives `quantizeStrength` 0.55 and `velocityVar` 0.26 — the loosest pair anywhere in this batch — plus timing jitter well above the boom-bap parent's and a non-continuous hat block. \"Vocal deliberately sings outside the loop's key, producing quarter-tone clashes as a stylistic feature\" cannot be a quarter tone in a 12-tone engine, so it is authored as the nearest available thing: `halfStepDissonance` 0.22 against a major-key table, which produces the same clash one semitone at a time. The melody *is* ODB's sung line rather than an instrument, so `timbreHint` is `vocal_chant` and the countermelody leans on `octave_echo`. Harmony is I–IV blues vamps with i–iv on the darker cuts, so `blues` and `major_blues` are real entries in the scale table. ⚠ `hihat.fillDensity` is 0.45 rather than lower: the pattern is irregular, not absent, and a model that declares a hat block owes every seed a hat. ⚠ `medium`, and the research marks the bar counts `[LOW-CONF]` specifically — \"verses of irregular length (11, 13, 19 bars)\" is an inference in the source, so `arrangement.sectionBars.verse` is authored as a [12,20] range rather than as those three numbers, and it is the one parameter here to re-verify first.",
  "session": {
    "bpm": {
      "min": 88,
      "max": 100,
      "mode": 94
    },
    "scales": {
      "values": [
        "major",
        "blues",
        "major_blues",
        "natural_minor"
      ],
      "weights": [
        4,
        3,
        2,
        2
      ]
    },
    "swing": {
      "grid": "16th",
      "amount": 0.6
    },
    "humanize": {
      "quantizeStrength": 0.55,
      "velocityVar": 0.26,
      "timingJitterMs": {
        "kick": 9,
        "snare": 10,
        "closedHat": 12,
        "openHat": 12,
        "rim": 10,
        "perc": 12
      }
    }
  },
  "drums": {
    "kick": {
      "densityPerBar": [
        2,
        4
      ],
      "anchors": [
        "1"
      ],
      "secondaryAnchor": "3&",
      "syncopation": 0.42
    },
    "snare": {
      "rimshotLayer": false,
      "offGridMs": 8,
      "ghost": {
        "prob": 0.3,
        "pos": [
          "1a",
          "2e",
          "3a",
          "4e"
        ],
        "vel": [
          0.18,
          0.45
        ]
      }
    },
    "hihat": {
      "base": "8th",
      "continuous": false,
      "fillDensity": 0.45,
      "velocities": {
        "main": [
          0.6,
          0.98
        ],
        "ghost": [
          0.12,
          0.5
        ]
      },
      "rolls": {
        "vocab": {
          "values": [
            "16"
          ],
          "weights": [
            1
          ]
        },
        "positions": [
          "phrase_end"
        ],
        "freqPerBar": 0.13
      },
      "openHat": {
        "prob": 0.3,
        "pos": [
          "1&",
          "2&",
          "3&",
          "4&"
        ],
        "perBar": [
          0,
          2
        ]
      }
    },
    "fills": {
      "smallEveryBars": 2,
      "bigEveryBars": 8
    },
    "snareRoll": {
      "subdivisions": [
        "16th"
      ],
      "grouping": [
        "even"
      ],
      "velocityRampRange": [
        44,
        104
      ],
      "gapProb": 0.23,
      "descendProb": 0.57,
      "rampJitter": 24,
      "pitchWalk": 2
    }
  },
  "melody": {
    "register": [
      62,
      86
    ],
    "densityPerBar": [
      3,
      7
    ],
    "intervals": {
      "step": 0.56,
      "third": 0.26,
      "leap": 0.18
    },
    "contour": {
      "riff": 0.34,
      "descend": 0.38,
      "arch": 0.28
    },
    "chordToneBias": 0.52,
    "halfStepDissonance": 0.22,
    "octaveJumpProb": 0.16,
    "phraseBars": {
      "values": [
        2,
        4
      ],
      "weights": [
        3,
        3
      ]
    },
    "timbreHint": "vocal_chant"
  },
  "countermelody": {
    "registerOffset": -12,
    "densityRatio": 0.46,
    "styles": {
      "values": [
        "octave_echo",
        "answer_lick"
      ],
      "weights": [
        4,
        2
      ]
    }
  },
  "chords": {
    "progressionFamilies": [
      {
        "roman": [
          "I",
          "IV"
        ],
        "weight": 5
      },
      {
        "roman": [
          "i",
          "iv"
        ],
        "weight": 3
      },
      {
        "roman": [
          "I",
          "IV",
          "V"
        ],
        "weight": 2
      }
    ],
    "maxChords": 3,
    "extensions": {
      "triad": 0.44,
      "seventh": 0.46,
      "ninth": 0.1
    },
    "voicing": {
      "style": "close",
      "register": [
        47,
        76
      ],
      "topVoiceStepwise": false
    },
    "harmonicRhythm": {
      "values": [
        "2_bars_per_chord",
        "1_per_bar",
        "vamp"
      ],
      "weights": [
        3,
        3,
        2
      ]
    }
  },
  "bassline": {
    "rhythm": "mirror_kick",
    "followRootsProb": 0.85,
    "register": [
      28,
      46
    ],
    "glideProb": 0.05,
    "passingTones": [
      "P5",
      "m7"
    ],
    "anticipationProb": 0.22
  },
  "arrangement": {
    "sectionBars": {
      "intro": [
        4,
        8
      ],
      "verse": [
        12,
        20
      ],
      "hook": 8,
      "bridge": [
        4,
        8
      ],
      "outro": 4
    },
    "transitions": {
      "dropOutBeats": {
        "prob": 0.4,
        "beats": 2
      },
      "switchUpProb": 0.3
    }
  }
}
