{
  "$schema": "../schema/artist-style.schema.json",
  "id": "lupe-fiasco",
  "type": "artist",
  "name": "Lupe Fiasco",
  "aliases": [
    "lupe fiasco",
    "lupe",
    "wasalu jaco",
    "food and liquor"
  ],
  "tier": "standard",
  "extends": [
    "boom-bap"
  ],
  "era": "2006-2011",
  "genres": [
    "rap",
    "boom-bap"
  ],
  "relatedGenres": [
    "boom-bap",
    "pop-2000s",
    "neo-soul"
  ],
  "confidence": "medium",
  "sources": [
    "style-research-extended vol.1 boom-bap — Lupe Fiasco",
    "Wikipedia — Kick, Push (https://en.wikipedia.org/wiki/Kick,_Push)",
    "Wikipedia — Lupe Fiasco's Food & Liquor (https://en.wikipedia.org/wiki/Lupe_Fiasco%27s_Food_%26_Liquor)"
  ],
  "notes": "The research's distinguishing claim is brightness: \"major-key sample material as often as minor — waltz-adjacent and orchestral sources give brighter harmony than the lane norm\". That is why `scales` puts major on top with lydian present, why the progression families lead with I–IV–V and I–vi–ii–V, and why `borrowed.V` sits at 0.3 for the real cadences the research names. `structure` is `long_arc` and `phraseBars` runs 4 and 8 because these are narrative song-form records with intro/verse/chorus/bridge rather than loops, and `transitions.switchUpProb` 0.3 is the documented beat switch for the final verse. The bass is \"replayed with melodic motion\" — `independent_riff` at 0.5 with M3 and M6 in the passing tones, which is what makes it read major rather than modal. Hats are 8ths with a 16th ornament, so `fillDensity` 0.46 rather than a 16th base. ⚠ `confidence` is medium and the research says so directly: \"song and album documentation; tempo range is catalog-level\". ⚠ The INFERRED parameters are `bpm` (a catalog-level band, not a session sheet) and every drum density — the research names the kit's parts and their positions, never their rates, so `fillDensity`, `openHat.prob` and the perc lane list are this author's reading of \"live-sounding kits layered with programmed hits\".",
  "session": {
    "bpm": {
      "min": 88,
      "max": 100,
      "mode": 94
    },
    "scales": {
      "values": [
        "major",
        "natural_minor",
        "dorian",
        "lydian"
      ],
      "weights": [
        4,
        3,
        2,
        1
      ]
    },
    "swing": {
      "grid": "16th",
      "amount": 0.55
    },
    "humanize": {
      "quantizeStrength": 0.78,
      "velocityVar": 0.17
    }
  },
  "drums": {
    "kick": {
      "densityPerBar": [
        2,
        4
      ],
      "anchors": [
        "1"
      ],
      "secondaryAnchor": "3&",
      "syncopation": 0.36,
      "tresilloBias": 0.1
    },
    "snare": {
      "rimshotLayer": true,
      "ghost": {
        "prob": 0.26,
        "pos": [
          "1a",
          "3a"
        ],
        "vel": [
          0.2,
          0.36
        ]
      }
    },
    "hihat": {
      "base": "8th",
      "continuous": true,
      "fillDensity": 0.46,
      "velocities": {
        "main": [
          0.74,
          0.94
        ],
        "ghost": [
          0.18,
          0.42
        ]
      },
      "rolls": {
        "vocab": {
          "values": [
            "16T"
          ],
          "weights": [
            1
          ]
        },
        "positions": [
          "bar_4"
        ],
        "freqPerBar": 0.22
      },
      "openHat": {
        "prob": 0.3,
        "pos": [
          "2&",
          "4&"
        ],
        "perBar": [
          1,
          2
        ]
      }
    },
    "percs": {
      "lanes": [
        "ride",
        "rim",
        "perc"
      ],
      "tambourine": true,
      "densityPerBar": [
        1,
        2
      ],
      "gainOffsetDb": -7
    },
    "fills": {
      "smallEveryBars": 4,
      "bigEveryBars": 8
    },
    "snareRoll": {
      "subdivisions": [
        "16th",
        "16t"
      ],
      "grouping": [
        "strong_weak_weak_weak"
      ],
      "velocityRampRange": [
        66,
        120
      ],
      "rampJitter": 15,
      "gapProb": 0.3,
      "descendProb": 0.45,
      "pitchWalk": 2
    }
  },
  "melody": {
    "register": [
      63,
      87
    ],
    "densityPerBar": [
      4,
      8
    ],
    "intervals": {
      "step": 0.62,
      "third": 0.28,
      "leap": 0.1
    },
    "contour": {
      "riff": 0.28,
      "descend": 0.3,
      "arch": 0.42
    },
    "chordToneBias": 0.76,
    "octaveJumpProb": 0.1,
    "phraseBars": {
      "values": [
        4,
        8
      ],
      "weights": [
        3,
        2
      ]
    },
    "structure": "long_arc",
    "timbreHint": "horn_stab"
  },
  "countermelody": {
    "registerOffset": 12,
    "densityRatio": 0.5,
    "styles": {
      "values": [
        "arp",
        "answer_lick"
      ],
      "weights": [
        3,
        2
      ]
    }
  },
  "chords": {
    "progressionFamilies": [
      {
        "roman": [
          "I",
          "IV",
          "V"
        ],
        "weight": 4
      },
      {
        "roman": [
          "ii",
          "v",
          "i"
        ],
        "weight": 3
      },
      {
        "roman": [
          "i",
          "VI",
          "III",
          "VII"
        ],
        "weight": 3
      },
      {
        "roman": [
          "I",
          "vi",
          "ii",
          "V"
        ],
        "weight": 2
      },
      {
        "roman": [
          "i",
          "iv"
        ],
        "weight": 2
      }
    ],
    "maxChords": 4,
    "borrowed": {
      "V": 0.3
    },
    "extensions": {
      "triad": 0.38,
      "seventh": 0.44,
      "ninth": 0.18
    },
    "voicing": {
      "style": "open",
      "register": [
        48,
        76
      ],
      "topVoiceStepwise": true
    },
    "harmonicRhythm": {
      "values": [
        "1_per_bar",
        "2_bars_per_chord",
        "vamp"
      ],
      "weights": [
        4,
        3,
        1
      ]
    }
  },
  "bassline": {
    "rhythm": "independent_riff",
    "followRootsProb": 0.5,
    "register": [
      28,
      47
    ],
    "glideProb": 0.08,
    "passingTones": [
      "P5",
      "M3",
      "M2",
      "M6"
    ],
    "anticipationProb": 0.3
  },
  "arrangement": {
    "sectionBars": {
      "bridge": [
        8,
        16
      ]
    },
    "transitions": {
      "switchUpProb": 0.3
    }
  }
}
